Head_Type,Head_Entity,Relation,Tail_Type,Tail_Entity,Description
Clinical_Test,PRISMA,evaluates,Research_Method,systematic reviews,PRISMA用于评估系统综述的报告质量
Risk_Factor,indirectness,affects,Evidence,quality,间接性影响证据的质量
Risk_Factor,protocol registration,affects,Research_Method,quality,协议注册影响系统综述的质量
Disease,Alzheimer's disease,has_symptom,Clinical_Manifestation,language barrier,阿尔茨海默病的主要症状之一是语言障碍
Research_Method,SR/MA,assesses,Treatment,acupuncture,系统综述和荟萃分析用于评估针灸治疗阿尔茨海默病的疗效
Clinical_Test,ADL,evaluates,Clinical_Manifestation,daily living activities,ADL评分用于评估阿尔茨海默病患者的日常生活能力
Risk_Factor,study quality,affects,Evidence,quality,研究质量不足影响证据的质量
Clinical_Test,ROBIS,evaluates,Research_Method,systematic reviews,ROBIS用于评估系统综述的偏倚风险
Treatment,acupuncture,treats,Disease,Alzheimer's disease,针灸是阿尔茨海默病的补充治疗方法
Research_Method,ROBIS,evaluates,Research_Method,SRs/MAs,ROBIS用于评估系统综述和荟萃分析的偏倚风险
Research_Method,ROBIS,assesses,Risk_Factor,bias,ROBIS工具用于评估系统综述中的偏倚风险
Disease,Alzheimer's disease,has_symptom,Clinical_Manifestation,emotional changes,阿尔茨海默病的主要症状之一是情绪变化
Risk_Factor,search strategy,affects,Research_Method,quality,文献检索策略影响系统综述的质量
Research_Method,GRADE,evaluates,Evidence,quality,GRADE系统用于评估证据的质量
Risk_Factor,data synthesis process,affects,Research_Method,quality,数据合成过程影响系统综述的质量
Risk_Factor,race diversity,affects,Evidence,quality,种族多样性不足可能导致发表偏倚
Research_Method,AMSTAR-2,evaluates,Research_Method,quality,AMSTAR-2工具用于评估系统综述的方法学质量
Risk_Factor,publication bias,affects,Evidence,quality,发表偏倚影响证据的质量
Treatment,acupuncture combined with CT,treats,Disease,Alzheimer's disease,针灸联合常规治疗用于治疗阿尔茨海默病
Risk_Factor,small sample size,affects,Evidence,quality,小样本量影响证据的质量
Risk_Factor,imprecision,affects,Evidence,quality,不精确性影响证据的质量
Risk_Factor,language bias,affects,Evidence,quality,语言偏倚可能影响证据的质量
Disease,Alzheimer's disease,has_treatment,Treatment,acupuncture,针灸是阿尔茨海默病的一种有前景的补充治疗方法
Research_Method,GRADE,evaluates,Research_Method,RCTs,GRADE用于评估随机对照试验的证据质量
Disease,Alzheimer's disease,requires,Research_Method,future RCTs,阿尔茨海默病需要未来更大样本量的随机对照试验来验证针灸的临床效果
Risk_Factor,inconsistency,affects,Evidence,quality,结果的不一致性影响证据的质量
Treatment,CT,treats,Disease,Alzheimer's disease,常规治疗用于治疗阿尔茨海默病
Research_Method,PRISMA,evaluates,Research_Method,SRs/MAs,PRISMA用于评估系统综述和荟萃分析的报告质量
Risk_Factor,low quality RCTs,affects,Evidence,quality,低质量的随机对照试验影响证据的质量
Risk_Factor,allocation concealment,affects,Evidence,quality,分配隐藏不明确影响证据的质量
Risk_Factor,sample size,affects,Evidence,quality,样本量不足影响证据的质量
Risk_Factor,randomization method,affects,Evidence,quality,随机化方法不明确影响证据的质量
Clinical_Test,MMSE,evaluates,Clinical_Manifestation,cognitive function,MMSE评分用于评估阿尔茨海默病患者的认知功能
Risk_Factor,geographical bias,affects,Evidence,quality,地理偏倚可能影响证据的质量
Research_Method,STRICTA,guides,Research_Method,RCTs,STRICTA建议用于指导针灸临床试验的报告
Clinical_Test,GRADE,evaluates,Research_Method,evidence quality,GRADE用于评估证据质量
Clinical_Test,AMSTAR-2,evaluates,Research_Method,systematic reviews,AMSTAR-2用于评估系统综述的方法学质量
Research_Method,CONSORT,guides,Research_Method,RCTs,CONSORT声明用于指导随机对照试验的报告
Treatment,sham acupuncture,treats,Disease,Alzheimer's disease,假针灸用于治疗阿尔茨海默病
Clinical_Test,HDS,evaluates,Clinical_Manifestation,cognitive function,HDS评分用于评估阿尔茨海默病患者的认知功能
Risk_Factor,excluded studies list,affects,Research_Method,quality,未提供排除研究列表影响系统综述的质量
Risk_Factor,funding support,affects,Research_Method,quality,资金支持信息不足影响系统综述的质量
Risk_Factor,blinding,affects,Evidence,quality,盲法实施不足影响证据的质量
Research_Method,AMSTAR-2,evaluates,Research_Method,SRs/MAs,AMSTAR-2用于评估系统综述和荟萃分析的质量
Disease,Alzheimer's disease,treated_by,Treatment,acupuncture,针灸被用于治疗阿尔茨海默病
Disease,Alzheimer's disease,has_symptom,Clinical_Manifestation,cognitive impairment,阿尔茨海默病的主要症状之一是认知障碍
Risk_Factor,bias risk explanation,affects,Research_Method,quality,偏倚风险解释不足影响系统综述的质量
Disease,Alzheimer's disease,has_symptom,Clinical_Manifestation,declining memory,阿尔茨海默病的主要症状之一是记忆力下降
