Head_Type,Head_Entity,Relation,Tail_Type,Tail_Entity,Description
Disease,Alzheimer's disease,has_symptom,Clinical_Manifestation,quality of caregiver's and family's lives,照顾者和家庭生活质量是阿尔茨海默病的重要症状
Disease,Alzheimer's disease,has_data_source,Research_Method,Gothenburg population study H70,阿尔茨海默病研究数据来源于哥德堡H70人口研究
Disease,Alzheimer's disease,requires,Research_Method,data harmonization,阿尔茨海默病研究需要数据协调
Imaging_Method,functional neuroimaging,detects,Biomarker,brain activity,功能性神经影像学用于检测大脑活动
Imaging_Method,structural neuroimaging,detects,Biomarker,brain structure,结构性神经影像学用于检测大脑结构
Clinical_Test,neurological examination,evaluates,Clinical_Manifestation,neurological health,神经系统检查用于评估神经系统健康
Disease,Alzheimer's disease,requires,Clinical_Test,outcome prioritization,阿尔茨海默病需要基于疾病阶段的结局优先排序
Disease,Alzheimer's disease,has_symptom,Clinical_Manifestation,functional ability and independence,功能能力和独立性是阿尔茨海默病的重要症状
Disease,Alzheimer's disease,has_symptom,Clinical_Manifestation,behavioral symptoms,行为症状是阿尔茨海默病的重要症状
Clinical_Test,functional ability/independence,evaluates,Clinical_Manifestation,functional ability,功能能力和独立性评估用于评估功能能力
Disease,Alzheimer's disease,has_outcome,Clinical_Manifestation,mortality,阿尔茨海默病的结果包括死亡率
Research_Method,Data Cube,combines,Clinical_Manifestation,data sources and disease stages,数据立方体结合了数据源和疾病阶段
Clinical_Test,physical examination,evaluates,Clinical_Manifestation,physical health,体格检查用于评估身体健康
Research_Method,consultations,identifies,Clinical_Test,priority outcomes,咨询用于识别优先结局
Disease,Alzheimer's disease,has_data_source,Research_Method,Registry of Dementias of Girona,阿尔茨海默病研究数据来源于吉罗纳痴呆症登记处
Disease,Alzheimer's disease,has_symptom,Clinical_Manifestation,cognitive ability,认知能力是阿尔茨海默病的重要症状
Disease,Alzheimer's disease,has_symptom,Clinical_Manifestation,language difficulties,阿尔茨海默病症状包括语言障碍
Disease,Alzheimer's disease,has_data_source,Research_Method,DPUK catalog,阿尔茨海默病研究数据来源于DPUK目录
Disease,Alzheimer's disease,has_data_source,Research_Method,Memento,阿尔茨海默病研究数据来源于Memento研究
Clinical_Test,cognitive ability,evaluates,Clinical_Manifestation,cognitive function,认知能力评估用于评估认知功能
Disease,Alzheimer's disease,has_outcome,Clinical_Manifestation,comorbidities,阿尔茨海默病的结果包括合并症
Treatment,therapeutic treatment,treats,Disease,Alzheimer's disease,治疗性治疗用于治疗阿尔茨海默病
Research_Method,surveys,identifies,Clinical_Test,priority outcomes,调查用于识别优先结局
Disease,Alzheimer's disease,has_data_source,Research_Method,EMIF-AD catalog,阿尔茨海默病研究数据来源于EMIF-AD目录
Clinical_Test,MMSE,evaluates,Clinical_Manifestation,cognitive function,简易精神状态检查用于评估认知功能
Disease,Alzheimer's disease,requires,Research_Method,data governance,阿尔茨海默病研究需要数据治理
Disease,Alzheimer's disease,has_outcome,Clinical_Manifestation,behavioral/neuropsychiatric symptoms,阿尔茨海默病的结果包括行为/神经精神症状
Disease,Alzheimer's disease,has_outcome,Clinical_Manifestation,cognitive ability,阿尔茨海默病的结果包括认知能力
Disease,Alzheimer's disease,has_symptom,Clinical_Manifestation,neuropsychiatric symptoms,神经精神症状是阿尔茨海默病的重要症状
Research_Method,stakeholder survey,identifies,Clinical_Manifestation,AD outcomes,利益相关者调查用于识别阿尔茨海默病的相关结果
Disease,Alzheimer's disease,has_outcome,Clinical_Manifestation,treatment,阿尔茨海默病的结果包括治疗
Disease,Alzheimer's disease,has_stage,Clinical_Stage,moderate-to-severe AD,中度至重度阿尔茨海默病是阿尔茨海默病的一个阶段
Clinical_Test,behavioral symptoms,evaluates,Clinical_Manifestation,behavioral function,行为症状评估用于评估行为功能
Risk_Factor,APOE4,increases_risk_of,Disease,Alzheimer's disease,APOE4基因是阿尔茨海默病的重要风险因素
Disease,Alzheimer's disease,requires,Research_Method,Data Cube integration,阿尔茨海默病研究需要数据立方体整合
Disease,Alzheimer's disease,has_stage,Clinical_Stage,mild cognitive impairment,阿尔茨海默病包括轻度认知障碍阶段
Research_Method,systematic literature review,identifies,Clinical_Manifestation,AD outcomes,系统文献综述用于识别阿尔茨海默病的相关结果
Disease,Alzheimer's disease,has_stage,Clinical_Stage,mild AD,阿尔茨海默病包括轻度阿尔茨海默病阶段
Research_Method,Data Cube,assesses,Clinical_Manifestation,outcome relevance,数据立方体用于评估结果的相关性
Clinical_Test,quality of caregiver's and family's lives,evaluates,Clinical_Manifestation,caregiver and family quality of life,照顾者和家庭生活质量评估用于评估照顾者和家庭生活质量
Disease,Alzheimer's disease,has_stage,Clinical_Stage,MCI,阿尔茨海默病包括轻度认知障碍阶段
Disease,Alzheimer's disease,has_outcome,Clinical_Manifestation,functional ability/independence,阿尔茨海默病的结果包括功能能力/独立性
Research_Method,systematic literature review,identifies,Clinical_Test,priority outcomes,系统文献综述用于识别优先结局
Disease,Alzheimer's disease,has_data_source,Research_Method,clinical trials,阿尔茨海默病研究数据来源于临床试验
Disease,Alzheimer's disease,has_symptom,Clinical_Manifestation,patient quality of life,患者生活质量是阿尔茨海默病的重要症状
Disease,Alzheimer's disease,has_stage,Clinical_Stage,moderate-to-severe AD,阿尔茨海默病包括中度至重度阿尔茨海默病阶段
Disease,Alzheimer's disease,requires,Research_Method,data sharing initiatives,阿尔茨海默病研究需要数据共享倡议
Disease,Alzheimer's disease,has_stage,Clinical_Stage,MCI,轻度认知障碍是阿尔茨海默病的一个阶段
Clinical_Test,patient quality of life,evaluates,Clinical_Manifestation,quality of life,患者生活质量评估用于评估生活质量
Disease,Alzheimer's disease,has_symptom,Clinical_Manifestation,executive functions,阿尔茨海默病症状包括执行功能障碍
Disease,Alzheimer's disease,has_stage,Clinical_Stage,mild AD,轻度阿尔茨海默病是阿尔茨海默病的一个阶段
Clinical_Test,neuropsychiatric symptoms,evaluates,Clinical_Manifestation,neuropsychiatric function,神经精神症状评估用于评估神经精神功能
Research_Method,Data Cube,visualizes,Clinical_Manifestation,AD outcomes,数据立方体用于可视化阿尔茨海默病的相关结果
Disease,Alzheimer's disease,has_symptom,Clinical_Manifestation,memory loss,阿尔茨海默病症状包括记忆力丧失
Disease,Alzheimer's disease,has_data_source,Research_Method,EHR databases,阿尔茨海默病研究数据来源于电子健康记录数据库
Research_Method,Data Cube,identifies,Clinical_Manifestation,data gaps,数据立方体用于识别数据缺口
Research_Method,patient and public involvement consultations,identifies,Clinical_Manifestation,AD outcomes,患者和公众参与咨询用于识别阿尔茨海默病的相关结果
Disease,Alzheimer's disease,has_data_source,Research_Method,cohort studies,阿尔茨海默病研究数据来源于队列研究
